tokenspeed-kernel/python/tokenspeed_kernel/ops/lora/triton/configs/H100_80GB_HBM3/_lora_expand_kernel.json
{
  "(24576, 128, 'torch.bfloat16', 'torch.bfloat16', 'torch.bfloat16', 'torch.int32', 'torch.int32', 'torch.int32', 'torch.int32', 'torch.float32')": {
    "kwargs": {
      "BLOCK_K": 64,
      "BLOCK_N": 64,
      "BLOCK_S": 8
    },
    "maxnreg": null,
    "num_ctas": 1,
    "num_stages": 3,
    "num_warps": 4
  },
  "(24576, 16, 'torch.bfloat16', 'torch.bfloat16', 'torch.bfloat16', 'torch.int32', 'torch.int32', 'torch.int32', 'torch.int32', 'torch.float32')": {
    "kwargs": {
      "BLOCK_K": 16,
      "BLOCK_N": 128,
      "BLOCK_S": 8
    },
    "maxnreg": null,
    "num_ctas": 1,
    "num_stages": 1,
    "num_warps": 4
  },
  "(24576, 32, 'torch.bfloat16', 'torch.bfloat16', 'torch.bfloat16', 'torch.int32', 'torch.int32', 'torch.int32', 'torch.int32', 'torch.float32')": {
    "kwargs": {
      "BLOCK_K": 16,
      "BLOCK_N": 32,
      "BLOCK_S": 8
    },
    "maxnreg": 160,
    "num_ctas": 1,
    "num_stages": 2,
    "num_warps": 4
  },
  "(24576, 64, 'torch.bfloat16', 'torch.bfloat16', 'torch.bfloat16', 'torch.int32', 'torch.int32', 'torch.int32', 'torch.int32', 'torch.float32')": {
    "kwargs": {
      "BLOCK_K": 64,
      "BLOCK_N": 64,
      "BLOCK_S": 8
    },
    "maxnreg": null,
    "num_ctas": 1,
    "num_stages": 2,
    "num_warps": 4
  },
  "(4096, 128, 'torch.bfloat16', 'torch.bfloat16', 'torch.bfloat16', 'torch.int32', 'torch.int32', 'torch.int32', 'torch.int32', 'torch.float32')": {
    "kwargs": {
      "BLOCK_K": 64,
      "BLOCK_N": 128,
      "BLOCK_S": 16
    },
    "maxnreg": null,
    "num_ctas": 1,
    "num_stages": 1,
    "num_warps": 4
  },
  "(4096, 16, 'torch.bfloat16', 'torch.bfloat16', 'torch.bfloat16', 'torch.int32', 'torch.int32', 'torch.int32', 'torch.int32', 'torch.float32')": {
    "kwargs": {
      "BLOCK_K": 16,
      "BLOCK_N": 128,
      "BLOCK_S": 16
    },
    "maxnreg": null,
    "num_ctas": 1,
    "num_stages": 2,
    "num_warps": 4
  },
  "(4096, 32, 'torch.bfloat16', 'torch.bfloat16', 'torch.bfloat16', 'torch.int32', 'torch.int32', 'torch.int32', 'torch.int32', 'torch.float32')": {
    "kwargs": {
      "BLOCK_K": 32,
      "BLOCK_N": 128,
      "BLOCK_S": 16
    },
    "maxnreg": null,
    "num_ctas": 1,
    "num_stages": 1,
    "num_warps": 4
  },
  "(4096, 64, 'torch.bfloat16', 'torch.bfloat16', 'torch.bfloat16', 'torch.int32', 'torch.int32', 'torch.int32', 'torch.int32', 'torch.float32')": {
    "kwargs": {
      "BLOCK_K": 64,
      "BLOCK_N": 128,
      "BLOCK_S": 16
    },
    "maxnreg": null,
    "num_ctas": 1,
    "num_stages": 1,
    "num_warps": 4
  },
  "(6144, 128, 'torch.bfloat16', 'torch.bfloat16', 'torch.bfloat16', 'torch.int32', 'torch.int32', 'torch.int32', 'torch.int32', 'torch.float32')": {
    "kwargs": {
      "BLOCK_K": 64,
      "BLOCK_N": 64,
      "BLOCK_S": 8
    },
    "maxnreg": 160,
    "num_ctas": 1,
    "num_stages": 1,
    "num_warps": 4
  },
  "(6144, 16, 'torch.bfloat16', 'torch.bfloat16', 'torch.bfloat16', 'torch.int32', 'torch.int32', 'torch.int32', 'torch.int32', 'torch.float32')": {
    "kwargs": {
      "BLOCK_K": 16,
      "BLOCK_N": 128,
      "BLOCK_S": 8
    },
    "maxnreg": 160,
    "num_ctas": 1,
    "num_stages": 3,
    "num_warps": 4
  },
  "(6144, 32, 'torch.bfloat16', 'torch.bfloat16', 'torch.bfloat16', 'torch.int32', 'torch.int32', 'torch.int32', 'torch.int32', 'torch.float32')": {
    "kwargs": {
      "BLOCK_K": 32,
      "BLOCK_N": 128,
      "BLOCK_S": 8
    },
    "maxnreg": null,
    "num_ctas": 1,
    "num_stages": 1,
    "num_warps": 4
  },
  "(6144, 64, 'torch.bfloat16', 'torch.bfloat16', 'torch.bfloat16', 'torch.int32', 'torch.int32', 'torch.int32', 'torch.int32', 'torch.float32')": {
    "kwargs": {
      "BLOCK_K": 16,
      "BLOCK_N": 32,
      "BLOCK_S": 8
    },
    "maxnreg": 160,
    "num_ctas": 1,
    "num_stages": 3,
    "num_warps": 4
  },
  "(8192, 128, 'torch.bfloat16', 'torch.bfloat16', 'torch.bfloat16', 'torch.int32', 'torch.int32', 'torch.int32', 'torch.int32', 'torch.float32')": {
    "kwargs": {
      "BLOCK_K": 64,
      "BLOCK_N": 128,
      "BLOCK_S": 16
    },
    "maxnreg": null,
    "num_ctas": 1,
    "num_stages": 1,
    "num_warps": 4
  },
  "(8192, 16, 'torch.bfloat16', 'torch.bfloat16', 'torch.bfloat16', 'torch.int32', 'torch.int32', 'torch.int32', 'torch.int32', 'torch.float32')": {
    "kwargs": {
      "BLOCK_K": 16,
      "BLOCK_N": 128,
      "BLOCK_S": 16
    },
    "maxnreg": null,
    "num_ctas": 1,
    "num_stages": 2,
    "num_warps": 4
  },
  "(8192, 32, 'torch.bfloat16', 'torch.bfloat16', 'torch.bfloat16', 'torch.int32', 'torch.int32', 'torch.int32', 'torch.int32', 'torch.float32')": {
    "kwargs": {
      "BLOCK_K": 32,
      "BLOCK_N": 128,
      "BLOCK_S": 16
    },
    "maxnreg": null,
    "num_ctas": 1,
    "num_stages": 1,
    "num_warps": 4
  },
  "(8192, 64, 'torch.bfloat16', 'torch.bfloat16', 'torch.bfloat16', 'torch.int32', 'torch.int32', 'torch.int32', 'torch.int32', 'torch.float32')": {
    "kwargs": {
      "BLOCK_K": 64,
      "BLOCK_N": 128,
      "BLOCK_S": 16
    },
    "maxnreg": null,
    "num_ctas": 1,
    "num_stages": 1,
    "num_warps": 4
  }
}
