tokenspeed-kernel/python/tokenspeed_kernel/ops/lora/triton/configs/H100_80GB_HBM3/_lora_qkv_expand_kernel.json
{
  "(1024, 128, 'torch.bfloat16', 'torch.bfloat16', 'torch.bfloat16', 'torch.int32', 'torch.int32', 'torch.int32', 'torch.int32', 'torch.int32', 'torch.float32')": {
    "kwargs": {
      "BLOCK_K": 64,
      "BLOCK_N": 128,
      "BLOCK_S": 16
    },
    "maxnreg": null,
    "num_ctas": 1,
    "num_stages": 1,
    "num_warps": 4
  },
  "(1024, 16, 'torch.bfloat16', 'torch.bfloat16', 'torch.bfloat16', 'torch.int32', 'torch.int32', 'torch.int32', 'torch.int32', 'torch.int32', 'torch.float32')": {
    "kwargs": {
      "BLOCK_K": 16,
      "BLOCK_N": 128,
      "BLOCK_S": 16
    },
    "maxnreg": null,
    "num_ctas": 1,
    "num_stages": 2,
    "num_warps": 4
  },
  "(1024, 32, 'torch.bfloat16', 'torch.bfloat16', 'torch.bfloat16', 'torch.int32', 'torch.int32', 'torch.int32', 'torch.int32', 'torch.int32', 'torch.float32')": {
    "kwargs": {
      "BLOCK_K": 32,
      "BLOCK_N": 128,
      "BLOCK_S": 16
    },
    "maxnreg": null,
    "num_ctas": 1,
    "num_stages": 1,
    "num_warps": 4
  },
  "(1024, 64, 'torch.bfloat16', 'torch.bfloat16', 'torch.bfloat16', 'torch.int32', 'torch.int32', 'torch.int32', 'torch.int32', 'torch.int32', 'torch.float32')": {
    "kwargs": {
      "BLOCK_K": 64,
      "BLOCK_N": 128,
      "BLOCK_S": 16
    },
    "maxnreg": null,
    "num_ctas": 1,
    "num_stages": 1,
    "num_warps": 4
  },
  "(2048, 128, 'torch.bfloat16', 'torch.bfloat16', 'torch.bfloat16', 'torch.int32', 'torch.int32', 'torch.int32', 'torch.int32', 'torch.int32', 'torch.float32')": {
    "kwargs": {
      "BLOCK_K": 64,
      "BLOCK_N": 128,
      "BLOCK_S": 16
    },
    "maxnreg": null,
    "num_ctas": 1,
    "num_stages": 1,
    "num_warps": 4
  },
  "(2048, 16, 'torch.bfloat16', 'torch.bfloat16', 'torch.bfloat16', 'torch.int32', 'torch.int32', 'torch.int32', 'torch.int32', 'torch.int32', 'torch.float32')": {
    "kwargs": {
      "BLOCK_K": 16,
      "BLOCK_N": 128,
      "BLOCK_S": 16
    },
    "maxnreg": null,
    "num_ctas": 1,
    "num_stages": 2,
    "num_warps": 4
  },
  "(2048, 32, 'torch.bfloat16', 'torch.bfloat16', 'torch.bfloat16', 'torch.int32', 'torch.int32', 'torch.int32', 'torch.int32', 'torch.int32', 'torch.float32')": {
    "kwargs": {
      "BLOCK_K": 32,
      "BLOCK_N": 128,
      "BLOCK_S": 16
    },
    "maxnreg": null,
    "num_ctas": 1,
    "num_stages": 1,
    "num_warps": 4
  },
  "(2048, 64, 'torch.bfloat16', 'torch.bfloat16', 'torch.bfloat16', 'torch.int32', 'torch.int32', 'torch.int32', 'torch.int32', 'torch.int32', 'torch.float32')": {
    "kwargs": {
      "BLOCK_K": 64,
      "BLOCK_N": 128,
      "BLOCK_S": 16
    },
    "maxnreg": null,
    "num_ctas": 1,
    "num_stages": 1,
    "num_warps": 4
  },
  "(4096, 128, 'torch.bfloat16', 'torch.bfloat16', 'torch.bfloat16', 'torch.int32', 'torch.int32', 'torch.int32', 'torch.int32', 'torch.int32', 'torch.float32')": {
    "kwargs": {
      "BLOCK_K": 64,
      "BLOCK_N": 128,
      "BLOCK_S": 16
    },
    "maxnreg": null,
    "num_ctas": 1,
    "num_stages": 1,
    "num_warps": 4
  },
  "(4096, 16, 'torch.bfloat16', 'torch.bfloat16', 'torch.bfloat16', 'torch.int32', 'torch.int32', 'torch.int32', 'torch.int32', 'torch.int32', 'torch.float32')": {
    "kwargs": {
      "BLOCK_K": 16,
      "BLOCK_N": 128,
      "BLOCK_S": 16
    },
    "maxnreg": null,
    "num_ctas": 1,
    "num_stages": 2,
    "num_warps": 4
  },
  "(4096, 32, 'torch.bfloat16', 'torch.bfloat16', 'torch.bfloat16', 'torch.int32', 'torch.int32', 'torch.int32', 'torch.int32', 'torch.int32', 'torch.float32')": {
    "kwargs": {
      "BLOCK_K": 32,
      "BLOCK_N": 128,
      "BLOCK_S": 16
    },
    "maxnreg": null,
    "num_ctas": 1,
    "num_stages": 1,
    "num_warps": 4
  },
  "(4096, 64, 'torch.bfloat16', 'torch.bfloat16', 'torch.bfloat16', 'torch.int32', 'torch.int32', 'torch.int32', 'torch.int32', 'torch.int32', 'torch.float32')": {
    "kwargs": {
      "BLOCK_K": 64,
      "BLOCK_N": 128,
      "BLOCK_S": 16
    },
    "maxnreg": null,
    "num_ctas": 1,
    "num_stages": 1,
    "num_warps": 4
  }
}
